{
  "schemaVersion": "1.0.0",
  "workflowId": "calculator",
  "root": {
    "id": "root",
    "kind": "sequence",
    "label": "Root",
    "path": "$.body",
    "children": [
      {
        "id": "calculate",
        "kind": "callBlock",
        "label": "math.calculate",
        "path": "$.body.statements[0]",
        "layout": {
          "direction": "top-down",
          "width": 280,
          "height": 92
        },
        "editable": true,
        "capabilities": {
          "toggleCollapsed": {
            "enabled": true,
            "label": "Collapse"
          },
          "updateField": {
            "enabled": true,
            "label": "Edit Metadata"
          },
          "insertNode": {
            "enabled": false,
            "label": "Insert Step",
            "reason": "Node kind does not accept child statements"
          },
          "deleteNode": {
            "enabled": true,
            "label": "Delete"
          },
          "moveStatement": {
            "enabled": true,
            "label": "Move"
          },
          "duplicateNode": {
            "enabled": true,
            "label": "Duplicate"
          },
          "replaceSubtree": {
            "enabled": true,
            "label": "Replace",
            "targetPath": "$.body.statements[0]"
          }
        },
        "inspector": [
          {
            "path": "$.body.statements[0].id",
            "label": "ID",
            "control": "text",
            "value": "calculate",
            "readonly": true
          },
          {
            "path": "$.body.statements[0].kind",
            "label": "Kind",
            "control": "text",
            "value": "callBlock",
            "readonly": true
          },
          {
            "path": "$.body.statements[0].block",
            "label": "Block",
            "control": "text",
            "value": "math.calculate",
            "readonly": true
          },
          {
            "path": "$.body.statements[0].inputs.left",
            "label": "Input left",
            "control": "expression",
            "value": {
              "kind": "ref",
              "ref": "input.left"
            }
          },
          {
            "path": "$.body.statements[0].inputs.operator",
            "label": "Input operator",
            "control": "expression",
            "value": {
              "kind": "ref",
              "ref": "input.operator"
            }
          },
          {
            "path": "$.body.statements[0].inputs.right",
            "label": "Input right",
            "control": "expression",
            "value": {
              "kind": "ref",
              "ref": "input.right"
            }
          },
          {
            "path": "$.body.statements[0].outputs.result",
            "label": "Output result",
            "control": "expression",
            "value": {
              "kind": "ref",
              "ref": "var.result"
            }
          }
        ]
      },
      {
        "id": "return_result",
        "kind": "return",
        "label": "Return",
        "path": "$.body.statements[1]",
        "layout": {
          "direction": "top-down",
          "width": 280,
          "height": 92
        },
        "editable": true,
        "capabilities": {
          "toggleCollapsed": {
            "enabled": true,
            "label": "Collapse"
          },
          "updateField": {
            "enabled": true,
            "label": "Edit Metadata"
          },
          "insertNode": {
            "enabled": false,
            "label": "Insert Step",
            "reason": "Node kind does not accept child statements"
          },
          "deleteNode": {
            "enabled": true,
            "label": "Delete"
          },
          "moveStatement": {
            "enabled": true,
            "label": "Move"
          },
          "duplicateNode": {
            "enabled": true,
            "label": "Duplicate"
          },
          "replaceSubtree": {
            "enabled": true,
            "label": "Replace",
            "targetPath": "$.body.statements[1]"
          }
        },
        "inspector": [
          {
            "path": "$.body.statements[1].id",
            "label": "ID",
            "control": "text",
            "value": "return_result",
            "readonly": true
          },
          {
            "path": "$.body.statements[1].kind",
            "label": "Kind",
            "control": "text",
            "value": "return",
            "readonly": true
          },
          {
            "path": "$.body.statements[1].returns.result",
            "label": "Return result",
            "control": "expression",
            "value": {
              "kind": "ref",
              "ref": "var.result"
            }
          }
        ],
        "metadata": {
          "returns": [
            "result"
          ]
        }
      }
    ],
    "layout": {
      "direction": "top-down",
      "width": 280,
      "height": 92
    },
    "editable": true,
    "capabilities": {
      "toggleCollapsed": {
        "enabled": true,
        "label": "Collapse"
      },
      "updateField": {
        "enabled": true,
        "label": "Edit Metadata"
      },
      "insertNode": {
        "enabled": true,
        "label": "Insert Step",
        "targetPath": "$.body.statements"
      },
      "deleteNode": {
        "enabled": false,
        "label": "Delete",
        "reason": "Root node cannot be deleted"
      },
      "moveStatement": {
        "enabled": false,
        "label": "Move",
        "reason": "Root node cannot be moved"
      },
      "duplicateNode": {
        "enabled": false,
        "label": "Duplicate",
        "reason": "Root node cannot be duplicated"
      },
      "replaceSubtree": {
        "enabled": true,
        "label": "Replace",
        "targetPath": "$.body"
      }
    },
    "inspector": [
      {
        "path": "$.body.id",
        "label": "ID",
        "control": "text",
        "value": "root",
        "readonly": true
      },
      {
        "path": "$.body.kind",
        "label": "Kind",
        "control": "text",
        "value": "sequence",
        "readonly": true
      }
    ]
  },
  "metadata": {
    "workflowName": "Calculator"
  }
}
